Link/DOI,Publication Date,Title,Authors,Abstract
10.3386/w32176,2024-02-26 00:00:00,The Secular Decline of Bank Balance Sheet Lending,"Greg Buchak, Gregor Matvos, Tomasz Piskorski, Amit Seru","The traditional model of bank-led financial intermediation, where banks issue demandable deposits to savers and make informationally sensitive loans to borrowers, has seen a dramatic decline since 1970s. Instead, private credit is increasingly intermediated through arms-length transactions, such as securitization. This paper documents these trends, explores their causes, and discusses their implications for the financial system and regulation. We document that the balance sheet share of overall private lending has declined from 60% in 1970 to 35% in 2023, while the deposit share of savings has declined from 22% to 13%. Additionally, the share of loans as a percentage of bank assets has fallen from 70% to 55%. We develop a structural model to explore whether technological improvements in securitization, shifts in saver preferences away from deposits, and changes in implicit subsidies and costs of bank activities can explain these shifts. Declines in securitization cost account for changes in aggregate lending quantities. Savers, rather than borrowers, are the main drivers of bank balance sheet size. Implicit banks’ costs and subsidies explain shifting bank balance sheet composition. Together, these forces explain the fall in the overall share of informationally sensitive bank lending in credit intermediation. We conclude by examining how these shifts impact the financial sector’s sensitivity to macroprudential regulation. While raising capital requirements or liquidity requirements decreases lending in both early (1960s) and recent (2020’s) scenarios, the effect is less pronounced in the later period due to the reduced role of bank balance sheets in credit intermediation. The substitution of bank balance sheet loans with debt securities in response to these policies explains why we observe only a fairly modest decline in aggregate lending despite a large contraction of bank balance sheet lending. Overall, we find that the intermediation sector has undergone significant transformation, with implications for macroprudential policy and financial regulation."
10.3386/w32172,2024-02-26 00:00:00,The Slanted-L Phillips Curve,"Pierpaolo Benigno, Gauti B. Eggertsson","A slanted-L curve is well-suited to represent the non-linearity of the celebrated Phillips curve. We show this using cross-country data of major industrialized economies since 2009, including the inflationary surge of the 2020s. At high unemployment rates, an increase in demand reduces unemployment without creating strong inflationary pressures. Meanwhile, supply shocks have a muted effect. At sufficiently low unemployment, there is a labor shortage, so that the economy is at full capacity. Then, higher demand is inflationary, and supply shocks are amplified. We derive a model of a slanted-L curve."
10.3386/w32171,2024-02-26 00:00:00,Competitive Job Seekers: When Sharing Less Leaves Firms at a Loss,"Gaurav Chiplunkar, Erin M. Kelley, Gregory V. Lane","We study how job-seekers share information about jobs within their social network, and its implications for firms. We randomly increase the amount of competition for a job and find that job-seekers are: (i) less likely to share information about the job with their peers; and (ii) choose to selectively share it with fewer higher ability peers. This lowers the quality of applicants received by firms, subsequent hires made, and performance on the job — suggesting that firms who rely on social networks to disseminate job information may see lower quality applicants than expected for their most competitive positions. While randomly offering higher wages attracts better talent, it is not able to fully overcome these strategic disincentives in information sharing"
10.3386/w32167,2024-02-26 00:00:00,Do Medical Treatments Work for Work? Evidence from Breast Cancer Patients,"N. Meltem Daysal, William N. Evans, Mikkel Hasse Pedersen, Mircea Trandafir","We investigate the effects of radiation therapy on the mortality and economic outcomes of breast cancer patients. We implement a 2SLS strategy within a difference-in-difference framework exploiting variation in treatment stemming from a medical guideline change in Denmark. Using administrative data, we reproduce results from an RCT showing the lifesaving benefits of radiotherapy. We then show therapy also has economic returns: ten years after diagnosis, treatment increases employment by 37% and earnings by 45%. Mortality and economic results are driven by results for more educated women, indicating that equalizing access to treatment may not be sufficient to reduce health inequalities."
10.3386/w32163,2024-02-26 00:00:00,The Cost of Money is Part of the Cost of Living: New Evidence on the Consumer Sentiment Anomaly,"Marijn A. Bolhuis, Judd N. L. Cramer, Karl Oskar Schulz, Lawrence H. Summers","Unemployment is low and inflation is falling, but consumer sentiment remains depressed. This has confounded economists, who historically rely on these two variables to gauge how consumers feel about the economy. We propose that borrowing costs, which have grown at rates they had not reached in decades, do much to explain this gap. The cost of money is not currently included in traditional price indexes, indicating a disconnect between the measures favored by economists and the effective costs borne by consumers. We show that the lows in US consumer sentiment that cannot be explained by unemployment and official inflation are strongly correlated with borrowing costs and consumer credit supply. Concerns over borrowing costs, which have historically tracked the cost of money, are at their highest levels since the Volcker-era. We then develop alternative measures of inflation that include borrowing costs and can account for almost three quarters of the gap in US consumer sentiment in 2023. Global evidence shows that consumer sentiment gaps across countries are also strongly correlated with changes in interest rates. Proposed U.S.-specific factors do not find much supportive evidence abroad."
10.3386/w32166,2024-02-26 00:00:00,On the Effects of Monetary Policy Shocks on Income and Consumption Heterogeneity,"Minsu Chang, Frank Schorfheide","In this paper we use the functional vector autoregression (VAR) framework of Chang, Chen, and Schorfheide (2024) to study the effects of monetary policy shocks (conventional and informational) on the cross-sectional distribution of U.S. earnings (from the Current Population Survey), consumption, and financial income (both from the Consumer Expenditure Survey). We find that a conventional expansionary monetary policy shock reduces earnings inequality, in large part by lifting individuals out of unemployment. There is a weakly positive effect on consumption inequality and no effect on financial income inequality, but credible bands are wide."
10.3386/w32179,2024-03-04 00:00:00,Do For-Profit Hospitals Cream-Skim Patients? Evidence from Inpatient Psychiatric Care in California,"Donghoon Lee, Anirban Basu, Jerome A. Dugan, Pinar Karaca-Mandic","The paper examines whether, among inpatient psychiatric admissions in California, for-profit (FP) hospitals engage in cream skimming, i.e., choosing patients for some characteristic(s) other than their need for care, which enhances the profitability of the provider. We propose a novel approach to identify cream skimming using cost outcomes. Naïve treatment effect estimates of hospital ownership type consist of the impact of differential patient case mix (selection) and hospital cost containment strategies (execution). In contrast, an instrumental variable (IV) approach can control for case mix and establish the causal effects of ownership type due to its execution. We interpret the difference in naïve and IV treatment effects to be driven by FP hospitals’ selection (cream skimming) based on unobserved patient case mix. We find that FP hospitals are more likely to treat high-cost patients than not-for-profit (NFP) hospitals, showing no evidence that FP hospitals engage in cream skimming. Our results may alleviate concerns surrounding the recent proliferation of FP psychiatric hospitals with regards to cream skimming."
10.3386/w32168,2024-02-26 00:00:00,Climate Policy Reform Options in 2025,"John Bistline, Kimberly A. Clausing, Neil Mehrotra, James H. Stock, Catherine Wolfram","With the expiration of many tax cuts and unmet climate targets, 2025 could be a crucial year for climate policy in the United States. Using an integrated model of energy supply and demand, this paper aims to assess climate policies that the U.S. federal government may consider in 2025 and to evaluate emissions reductions, fiscal costs and revenues, and household energy expenditures across a range of policy scenarios. Model results suggest that the emissions reductions of the Inflation Reduction Act are significantly augmented under scenarios that add a modest carbon fee or, to a lesser extent, that implement a clean electricity standard in the power sector. Second, net fiscal costs can be substantially reduced in scenarios that include a carbon fee, especially if fossil fuel exports are taxed. Third, expanding the IRA tax credits yields modest additional emissions reductions with higher fiscal costs. Finally, although none of the policy combinations across these scenarios achieve the U.S. target of a 50-52% economy-wide emissions reduction by 2030 from 2005 levels, the carbon fee and clean electricity standard scenarios achieve these levels between 2030 and 2035."
10.3386/w32170,2024-02-26 00:00:00,Do Information Frictions and Corruption Perceptions Kill Competition? A Field Experiment On Public Procurement in Uganda,"Emanuele Colonnelli, Francesco Loiacono, Edwin Muhumuza, Edoardo Teso","We study whether information frictions and corruption perceptions deter firms from doing business with the government. We conduct two nationwide randomized controlled trials (RCTs) in collaboration with the national public procurement supervisory and anti-corruption agency in Uganda. The first RCT aims to increase firms’ information on available procurement opportunities, which is limited due to the lack of a centralized e- procurement system. We provide firms with direct and timely access to information about government tenders over a two-year period. The second RCT focuses on firms’ perceptions about the integrity of public entities, which we experimentally show are key drivers of firms’ participation in procurement. We provide firms with access to structured information on other firms’ perceptions and on anti-corruption audits. We find that increasing information on available procurement opportunities alone does not increase firm participation in public procurement. However, changing firms’ perceptions about the integrity of public entities increases firms’ total number of bids and total government contracts won. Based on our findings, our partner agency implemented several measures to further restore firms’ trust in public entities. Overall, our findings point to the limits of transparency reforms that aim to increase competition in public procurement without accounting for firms’ perceptions about government corruption and inefficiency."
10.3386/w32165,2024-02-26 00:00:00,Early Childhood Intervention for the Poor: Long Term Outcomes,"Alison Andrew, Orazio Attanasio, Britta Augsburg, Lina Cardona-Sosa, Monimalika Day, Michele Giannola, Sally Grantham-McGregor, Pamela Jervis, Costas Meghir, Marta Rubio-Codina","Early childhood interventions aim to promote skill acquisition and poverty reduction. While their short-term success is well established, research on longer-term effectiveness is scarce, particularly in LDCs. We present results of a randomized scalable intervention in India, that affected developmental outcomes in the short-term, including cognition (0.36 SD p=0.005), receptive language (0.26 SD p=0.03) and expressive language (0.21 SD p=0.03). After 4.5 years, when the children were on average 7.5 years old, IQ was no longer affected, but impacts persisted relative to the control group in numeracy (0.330 SD, p=0.007) and literacy (0.272 SD, p=0.064) driven by the most disadvantaged."
10.3386/w32169,2024-02-26 00:00:00,Demand Shocks as Technology Shocks,"Yan Bai, José-Víctor Ríos-Rull, Kjetil Storesletten","We provide a macroeconomic theory where demand for goods has a productive role. A search friction prevents perfect matching between producers and potential customers. Larger demand induces more search, which in turn increases GDP and measured TFP. We embed the product-market friction in a standard neoclassical model and estimate it using Bayesian techniques. Business cycles are driven by preference shocks, true technology shocks, and investment-specific shocks. Preference shocks have qualitatively similar effects as true productivity shocks. These shocks account for a large share of the fluctuations in consumption, GDP, and measured TFP and can be identified using shopping time data."
10.3386/w32164,2024-02-26 00:00:00,"Heterogeneity, Uncertainty and Learning: Semiparametric Identification and Estimation","Jackson Bunting, Paul Diegert, Arnaud Maurel","We provide semiparametric identification results for a broad class of learning models in which continuous outcomes depend on three types of unobservables: i) known heterogeneity, ii) initially unknown heterogeneity that may be revealed over time, and iii) transitory uncertainty. We consider a common environment where the researcher only has access to a short panel on choices and realized outcomes. We establish identification of the outcome equation parameters and the distribution of the three types of unobservables, under the standard assumption that unknown heterogeneity and uncertainty are normally distributed. We also show that, absent known heterogeneity, the model is identified without making any distributional assumption. We then derive the asymptotic properties of a sieve MLE estimator for the model parameters, and devise a tractable profile likelihood based estimation procedure. Monte Carlo simulation results indicate that our estimator exhibits good finite-sample properties."
