Link/DOI,Publication Date,Title,Authors,Abstract
10.3386/w32215,2024-03-11 00:00:00,Product Liability Litigation and Innovation: Evidence from Medical Devices,"Alberto Galasso, Hong Luo","We examine the relationship between product liability litigation and innovation by systematically combining data on product liability lawsuits with data on new product introductions in a panel dataset of leading medical device firms. We first document a decline in the propensity to introduce new products for both defendant firms and other firms operating in litigated device categories. This decline, however, does not spill over to other device categories, and we also do not find any slowing down in firms' patenting activities. We then show that changes in two features of the regulatory environment---(1) the availability of public information regarding adverse events and (2) federal law taking precedence over state law---substantially affect the likelihood of litigation. These changes also provide quasi-exogenous variations in litigation that confirm our baseline findings. Finally, we show that litigation appears to induce firms to develop safer devices. Overall, our findings suggest that product liability litigation affects the rate and direction of technological progress, and that safety regulation and liability regimes interact with one another in significant ways."
10.3386/w32232,2024-03-11 00:00:00,"Air Pollution, Wildfire Smoke, and Worker Health","Marika Cabral, Marcus Dillender","Little is known about how pollution impacts worker health and workplace safety. This paper leverages high-frequency, plausibly exogenous variation in wildfire smoke to estimate the impact of pollution on workplace injuries. Our analysis draws on unique data we construct through linking information on smoke plumes and pollution to comprehensive administrative data on workers’ compensation injury claims from Texas. We first document that wildfire smoke increases ambient air pollution—with our estimates indicating that a day of smoke coverage is associated with an average increase in PM₂.₅ of 18.6%. We find that an additional day of smoke coverage leads to a 2.8% increase in workplace injury claims. Similar percent increases in workplace injuries are found across different types of injuries and workers. However, because of large variation in baseline injury risk, the incidence of these pollution-induced injuries is concentrated among workers in high-risk occupations, and supplemental analysis illustrates potential opportunities for improving the targeting of costly mitigation. Our estimates indicate that pollution—and wildfire smoke in particular—substantially harms worker health, even at pollution levels well below current and proposed regulatory standards. Overall, our findings suggest workers face unique risks from pollution and provide insights for policy aiming to address these risks."
10.3386/w32212,2024-03-11 00:00:00,Persistent Effects of Social Program Participation on the Third Generation,"Gordon B. Dahl, Anne Gielen","Can participation in safety net programs have long-lasting negative effects across multiple generations? Prior work shows a 1993 Dutch disability insurance reform which tightened requirements and lowered benefits for participants resulted in better outcomes for their children. We study the third generation, finding that grandchildren of individuals whose DI eligibility and benefits were reduced are less likely to be born premature, have low birthweight, or experience complicated deliveries. They also have better health and schooling outcomes during early childhood. These early-life improvements are consequential, as they have been linked to better health, education, and labor market outcomes in adulthood."
10.3386/w32217,2024-03-11 00:00:00,The Feasibility of Using Bayh-Dole March-In Rights to Lower Drug Prices: An Update,"Lisa Larrimore Ouellette, Bhaven N. Sampat","In December 2023, the Biden-Harris Administration released a proposed framework for exercising government “march-in” rights on high-priced taxpayer-funded drugs. While both proponents and critics of the new rules view them as having broad scope, march-in rights can be exercised only on patents that result from federally funded research, and they can enable generic entry only if all patents on a drug were public-sector patents. In this paper, we examine the feasibility of using march-in rights to lower pharmaceutical prices by examining patents on drugs approved by the U.S. Food and Drug Administration (FDA) from 1985 to 2022. Our primary analyses focus on the 883 new molecular entities with at least one patent listed in the FDA’s Orange Book since 1985. While 9 percent of these drugs have a public-sector patent, only 2.5 percent have only public-sector patents. While the new march-in rules could be a tool to lower prices for a few drugs, their overall impact on prices or expenditures will likely be limited. In addition to the updated analyses, we provide links to the data used in the analyses."
10.3386/w32216,2024-03-11 00:00:00,Equilibrium Responses to Price Controls: A Supply-Chain Approach,Casey B. Mulligan,"Prices are regulated in many markets, ranging from healthcare to labor to telecommunications.  This paper reinterprets the variables in the basic supply-demand model so that both product-definition and quantity are equilibrium outcomes.  Specifically, compliance with price controls is achieved by altering the production-factor mix along the supply chain.  This approach yields surprising insights into the incidence of price regulations and their effects on the amount of trade.  Furthermore, it reveals how many of the short-run effects of price controls can be opposite of what they are in the long run.  The supply-chain framework also easily represents business-to-business price controls, which have been more prevalent in policy practice than price-theoretic analysis."
10.3386/w32231,2024-03-11 00:00:00,A Practical Guide to Endogeneity Correction Using Copulas,"Yi Qian, Anthony Koschmann, Hui Xie","Causal inference is of central interests in many empirical applications yet often challenging because of the presence of endogenous regressors. The classical approach to the problem requires using instrumental variables that must satisfy the stringent condition of exclusion restriction. At the forefront of recent research, instrument-free copula methods have been increasingly used to handle endogenous regressors. This article aims to provide a practical guide for how to handle endogeneity using copulas. The authors give an overview of copula endogeneity correction and its usage in marketing research, discuss recent advances that broaden the understanding, applicability, and robustness of copula correction, and examine implementation challenges of copula correction such as construction of copula control functions and handling of higher-order terms of endogenous regressors. To facilitate the appropriate usage of copula correction, the authors detail a process of checking data requirements and identification assumptions to determine when and how to use copula correction methods, and illustrate its usage using empirical examples."
10.3386/w32230,2024-03-11 00:00:00,Sectoral Development Multipliers,"Francisco J. Buera, Nicholas Trachter","How should industrial policies be directed to reduce distortions and foster economic development? We study this question in a multi-sector model with technology adoption, where the production of goods and modern technologies features rich network structures. We provide simple formulas for the sectoral policy multipliers, and provide insights regarding the power of alternative policy instruments. We devise a simple procedure to estimate the model parameters and the distribution of technologies across sectors, which we apply to Indian data. We find that technology adoption greatly amplifies the multipliers' magnitudes, and it changes the ranking of priority sectors for industrial policy. Further, we find that adoption subsidies are the most cost-effective instrument for promoting economic development."
10.3386/w32229,2024-03-11 00:00:00,Toward an Understanding of the Returns to Cognitive Skills Across Cohorts,"Judith K. Hellerstein, Sai Luo, Sergio S. Urzúa","Recent research concludes that wage returns to cognitive skills have declined in the U.S. We reassess this finding. Using decomposition methods, we document the pivotal role played by dynamic shifts in the distributions of pre-labor market cognitive skills. Our findings show these shifts explain the declining estimated returns to cognitive skills, especially for white men. We discard measurement error as a potential driver. Although often overlooked, grappling with changing pre-labor market skill distributions is necessary for capturing the evolution of labor market returns to cognitive skills. This may prove especially important in the future given continuing changes in skill development in recent youth cohorts."
10.3386/w32234,2024-03-11 00:00:00,On Recoding Ordered Treatments as Binary Indicators,"Evan K. Rose, Yotam Shem-Tov",Researchers using instrumental variables to investigate ordered treatments often recode treatment into an indicator for any exposure. We investigate this estimand under the assumption that the instruments shift compliers from no treatment to some but not from some treatment to more. We show that when there are extensive margin compliers only (EMCO) this estimand captures a weighted average of treatment effects that can be partially unbundled into each complier group's potential outcome means. We also establish an equivalence between EMCO and a two-factor selection model and apply our results to study treatment heterogeneity in the Oregon Health Insurance Experiment.
10.3386/w32235,2024-03-11 00:00:00,"On the Feasibility, Costs, and Benefits of an Immediate Phasedown of Coal for U.S. Electricity Generation","Stephen P. Holland, Matthew Kotchen, Erin T. Mansur, Andrew J. Yates","The phasedown of coal for electricity generation is considered vital to meeting global climate targets. Many countries have pledged to stop using coal, with some as early as 2030. While the United States has no target currently in place, several states do. In this paper, we examine the feasibility of phasing down U.S. coal-generated electricity given the existing fleet of power plants. In particular, we take consumption as given and evaluate how prioritizing natural gas generation over that of coal would change emissions and operating costs. To do this, we develop a replacement algorithm based on transmission regions and marginal cost comparisons. Using our preferred scenarios, we find that between 66 and 94 percent of coal generation could be replaced immediately, reducing electricity sector carbon dioxide (CO₂) emissions between 18 and 29 percent – equivalent to between 5 and 8 percent of total U.S. energy related emissions. The cost range is between $49 and $92 per ton of CO₂, where benefit-cost ratios are favorable in some scenarios considering local pollutant co-benefits alone. Despite the command-and-control nature of prioritizing natural gas generation, we find it relatively cost effective even in comparison to a Pigouvian tax. We examine sensitivity of the results to transmission regions, replacement cost conditions, natural gas pipeline capacity, and alternative fuel prices."
10.3386/w32233,2024-03-11 00:00:00,Driving Under the Influence of Allergies: The Effect of Seasonal Pollen on Traffic Fatalities,"Shooshan Danagoulian, Monica Deza","Traffic fatalities are the leading cause of mortality in the United States despite being preventable. While several policies have been introduced to improve traffic safety and their effects have been well documented, the role of transitory health shocks or situational factors at explaining variations in fatal traffic accidents has been understudied. Exploring daily variation in city-specific pollen counts, this study finds novel evidence that traffic fatalities increase on days in which the local pollen count are particularly high. We find that the effects are present in accidents involving private vehicles and occur most frequently on the weekends, suggesting potentially the missed opportunity to avoid these fatalities. We do not find similar effects for fleet vehicles. These findings remain robust to alternative specifications and alternative definitions of high pollen count. Taken together, this study finds evidence that a prevalent and transitory exogenous health-shock, namely pollen allergies, increases traffic fatalities. Given our lack of evidence of avoidance, these effects are not mechanical and are likely driven by cognitive impairments that arise as a result of seasonal allergies."
10.3386/w32222,2024-03-11 00:00:00,Non-Binary Gender Economics,"Katherine B. Coffman, Lucas C. Coffman, Keith Marzilli Ericson","Economics research has largely overlooked non-binary individuals. We aim to jump-start the literature by providing data on several economically-important beliefs and preferences. Among many results, non-binary individuals report more gender-based discrimination and express different career and life aspirations, including less desire for children. Anti-non-binary sentiment is stronger than anti-LGBT sentiment, and strongest among men. Non-binary respondents report lower assertiveness than men and women, and their social preferences are similar to men’s and less prosocial than women’s, with age an important moderator. Elicited beliefs reveal inaccurate stereotypes as people often mistake the direction of group differences or exaggerate their size."
10.3386/w32228,2024-03-11 00:00:00,The Market and Climate Implications of U.S. LNG Exports,"James H. Stock, Matthew Zaragoza-Watkins","From 2015 to 2023, the United States transformed from a net importer of natural gas to the world's largest liquified natural gas (LNG) exporter. We find that this surge in LNG exports has reconnected U.S. gas prices to world market prices, after a hiatus of “shut-in” fracked gas. We estimate that the domestic gas price effect of this recoupling is comparable to a $30/ton carbon tax. For coal prices, which are coupled to gas through competition in the power sector, this effect is comparable to a $20/ton carbon tax. Using the NREL ReEDS model, we estimate that this recoupling reduces U.S. 2030 power sector CO2 emissions by roughly 145 million metric tons. These domestic estimates contribute to estimating the overall climate impact of LNG exports."
10.3386/w32220,2024-03-11 00:00:00,Movies,"Stelios Michalopoulos, Christopher Rauh","Why are certain movies more successful in some markets than others? Are the entertainment products we consume reflective of our core values and beliefs? These questions drive our investigation into the relationship between a society’s oral tradition and the financial success of films. We combine a unique catalog of local tales, myths, and legends around the world with data on international movie screenings and revenues. First, we quantify the similarity between movies’ plots and traditional motifs employing machine learning techniques. Comparing the same movie across different markets, we establish that films that resonate more with local folklore systematically accrue higher revenue and are more likely to be screened. Second, we document analogous patterns within the US. Google Trends data reveal a pronounced interest in markets where ancestral narratives align more closely with a movie’s theme. Third, we delve into the explicit values transmitted by films, concentrating on the depiction of risk and gender roles. Films that promote risk-taking sell more in entrepreneurial societies today, rooted in traditions where characters pursue dangerous tasks successfully. Films portraying women in stereotypical roles continue to find a robust audience in societies with similar gender stereotypes in their folklore and where women today continue being relegated to subordinate positions. These findings underscore the enduring influence of traditional storytelling on entertainment patterns in the 21st century, highlighting a profound connection between movie consumption and deeply ingrained cultural narratives and values."
10.3386/w32221,2024-03-11 00:00:00,Are Supply Networks Efficiently Resilient?,"Agostino Capponi, Chuan Du, Joseph E. Stiglitz","We show that supply networks are inefficiently, and insufficiently, resilient. Upstream firms can expand their production capacity to hedge against supply and demand shocks. But the social benefits of such investments are not internalized due to market power and market incompleteness. Upstream firms under-invest in capacity and resilience, passing-on the costs to down-stream firms, and drive trade excessively towards the spot markets. There is a wedge between the market solution and a constrained optimal benchmark, which persists even without rare and large shocks. Policies designed to incentivize capacity investment, reduce reliance on spot markets, and enhance competition ameliorate the externality."
10.3386/w32175,2024-02-26 00:00:00,From Dominant to Producer Currency Pricing: Dynamics of Chilean Exports,"José De Gregorio, Pablo García, Emiliano E. Luttini, Marco Rojas","We revisit a central question for international macroeconomics: the response of export prices and quantities to movements in the exchange rate (ER). We use granular export data for Chile and study how the effects of ER movements vary over time with the currency of invoicing and the destination of exports. For prices, we find that the short-run effects of bilateral ER movements vanish when controlling for U.S. dollar ER, which supports dominant currency pricing. However, over longer horizons a more significant role is played by bilateral ER movements, in line with the predictions of producer currency pricing. These dynamics do not depend on the invoicing currency. The results we find for quantities support the view that bilateral exchange rate movements contribute to macroeconomic adjustment through export volumes over the medium term."
10.3386/w32177,2024-02-26 00:00:00,Diversity and Discrimination in the Classroom,"Dan Anderberg, Gordon B. Dahl, Cristina Felfe, Helmut Rainer, Thomas Siedler","What makes diversity unifying in some settings but divisive in others?  We examine how the mixing of ethnic groups in German schools affects intergroup cooperation and trust. We leverage the quasi-random assignment of students to classrooms within schools to obtain variation in the type of diversity that prevails in a peer group. We combine this with a large-scale, incentivized lab-in-field-experiment based on the investment game, allowing us to assess the in-group bias of native German students in their interactions with fellow natives (in-group) versus immigrants (out-group). We find in-group bias peaks in culturally polarized classrooms, where the native and immigrant groups are both large, but have different religious or language backgrounds.  In contrast, in classrooms characterized by non-cultural polarization, fractionalization, or a native supermajority, there are significantly lower levels of own-group favoritism. In terms of mechanisms, we find empirical evidence that culturally polarized classrooms foster negative stereotypes about immigrants' trustworthiness and amplify taste-based discrimination, both of which are costly and lead to lower payouts. In contrast, accurate statistical discrimination is ruled out by design in our experiment. These findings suggest that extra efforts are needed to counteract low levels of inclusivity and trust in culturally polarized environments."
10.3386/w32219,2024-03-11 00:00:00,Navigating by Falling Stars: Monetary Policy with Fiscally Driven Natural Rates,"Rodolfo G. Campos, Jesús Fernández-Villaverde, Galo Nuño, Peter Paz","We study a new type of monetary-fiscal interaction in a heterogeneous-agent New Keynesian model with a fiscal block. Due to household heterogeneity, the stock of public debt affects the natural interest rate, forcing the central bank to adapt its monetary policy rule to the fiscal stance to guarantee that inflation remains at its target. There is, however, a minimum level of debt below which the steady-state inflation deviates from its target due to the zero lower bound on nominal rates. We analyze the response to a debt-financed fiscal expansion and quantify the impact of different timings in the adaptation of the monetary policy rule, as well as the performance of alternative monetary policy rules that do not require an assessment of the natural rates. We validate our findings with a series of empirical estimates."
10.3386/w32227,2024-03-11 00:00:00,Losing Medicaid and Crime,"Monica Deza, Thanh Lu, Johanna Catherine Maclean, Alberto Ortega","We study the impact of losing health insurance on criminal activity by leveraging one of the most substantial Medicaid disenrollments in U.S. history, which occurred in Tennessee in 2005 and lead to 190,000 non–elderly and non–disabled adults without dependents unexpectedly losing coverage. Using police agency–level data and a difference–in–differences approach, we find that this mass insurance loss increased total crime rates with particularly strong effects for non–violent crime. We test for several potential mechanisms and find that our results may be explained by economic stability and access to healthcare, in particular mental healthcare."
10.3386/w32226,2024-03-11 00:00:00,Fallow Lengths and the Structure of Property Rights,"Etienne Le Rossignol, Sara Lowes, Eduardo Montero","We study a fundamental institution in many societies: the structure of property rights over land. Across societies, communal land rights have been more common than private land rights. We test the hypothesis that longer fallow requirements – the time needed to leave land uncultivated to restore fertility – led to a higher prevalence of communal property rights. Longer fallow requirements generate higher protection costs and therefore make communal rights more beneficial. We construct an ecological measure of the optimal fallow length for the most suitable staple crop across grid cells based on soil type, temperature, and climate. We find that places where land needs to be fallowed for longer periods are more likely to have communal property rights both historically and presently. We then examine the implications for efforts to title land. We find that World Bank land titling interventions are less effective in places with longer fallow requirements, suggesting a mismatch between development policy and underlying institutions. Finally, we examine implications for income inequality and conflict. We find that longer fallow requirements are associated with less inequality, less conflict, and greater resilience to negative shocks. Our results highlight the origins of property rights structures and how communal property rights interact with development policies."
10.3386/w32173,2024-02-26 00:00:00,Long-Range Forecasts As Climate Adaptation: Experimental Evidence From Developing-Country Agriculture,"Fiona Burlig, Amir Jina, Erin M. Kelley, Gregory V. Lane, Harshil Sahai","Climate change increases weather variability, exacerbating agricultural risk in poor countries. Risk-averse farmers are unable to tailor their planting decisions to the coming season, and underinvest in profitable inputs. Accurate, long-range forecasts enable farmers to optimize for the season ahead. We experimentally evaluate monsoon onset forecasts in India, randomizing 250 villages into control; a forecast group receiving information well in advance of onset; and a benchmark index insurance group. Forecast farmers update their beliefs and their behavior: farmers who receive “bad news” relative to their priors substantially reduce land under cultivation and certain input expenditures, while those receiving “good news” significantly increase input expenditures. The forecast also impacts crop choice, as farmers tailor their investments. These investment changes meaningfully alter ex post outcomes. In contrast, insurance, which provides no information, increases investments but does not change crops. Our results demonstrate that forecasts are a promising tool for climate adaptation"
10.3386/w32174,2024-02-26 00:00:00,Sectoral Debt and Global Dollar Cycles in Developing Economies,"Bada Han, Rashad Ahmed, Joshua Aizenman, Yothin Jinjarak","We explore the role of sectoral debt dynamics in shaping business cycles in a sample of 52 Emerging Market Economies (EMEs) and Frontier Market Economies (FMEs) from 2005 to 2021. Higher household debt levels and growth are associated with significantly slower GDP growth in more developed EMEs but not in less developed EMEs and FMEs. We also examine the relationship between US dollar cycles, sectoral debt levels and growth, and economic activity. Among developed EMEs, higher expected household debt growth magnifies the impact of US dollar fluctuations on economic activity, with significant but less persistent effects on consumption and more persistent effects on investment. Our empirical findings highlight the important role of household debt dynamics in relatively developed EMEs."
