Title,Publication Date,Authors,Link,DOI,Abstract
Long Social Distancing,2022-10-17 00:00:00,"Jose Maria Barrero, Nicholas Bloom, Steven J. Davis",https://www.nber.org/papers/w30568,10.3386/w30568,"Many working-age Americans plan to continue some forms of social distancing after the COVID-19 pandemic ends. We uncover this long social distancing phenomenon in our monthly Survey of Working Arrangements and Attitudes. It is stronger among older persons, the less educated, and those who live with or care for persons at high risk from infectious diseases. Regression models fit to individual-level data suggest that social distancing lowered labor force participation by 2.4 percentage points in 2022, 1.2 points on an earnings-weighted basis. These effects are highly concentrated among persons with long COVID experiences or daily interactions with at-risk persons. When combined with simple equilibrium models, our results imply that the participation drag reduced U.S. output by $205 billion in 2022, shrank the college wage premium by 2.1 percentage points, and modestly steepened the cross-sectional age-wage profile. The social-distancing drag on participation diminished by an estimated 1.6 percentage points from February 2022 to April 2023. Drawing on self-assessed causal effects in a separate analysis, infection worries lowered participation by an estimated one percentage point as of late 2022."
A Simple Model of Social Distancing and Vaccination,2021-11-08 00:00:00,Christopher Avery,https://www.nber.org/papers/w29463,10.3386/w29463,"This paper analyzes a simple model of infectious disease where the incentives for individuals to reduce risks through endogenous social distancing take straightforward cost-benefit form. Since disease is transmitted through social interactions, the threat of spread of infection poses a collective action problem. Policy interventions such as lockdowns, testing, and mask-wearing serve, in part, as substitutes for social distancing. Provision of a vaccination is the only intervention that unambiguously reduces both the peak infection level and the herd immunity level of infection. Adoption of vaccination remains limited in a decentralized equilibrium, with resulting reproductive rate of disease Rt > 1 at the conclusion of vaccination. Vaccine mandates yield increases in vaccination rates and corresponding reductions in future infection rates but do not increase expected payoffs to individuals."
The Incidence and Magnitude of the Health Costs of In-person Schooling during the COVID-19 Pandemic,2021-03-29 00:00:00,Casey B. Mulligan,https://www.nber.org/papers/w28619,10.3386/w28619,"The health costs of in-person schooling during the pandemic, if any, fall primarily on the families of students, largely due to the fact that students significantly outnumber teachers.  Data from North Carolina, Wisconsin, Australia, England, and Israel covering almost 80 million person-days in school help assess the magnitude of the fatality risks of in-person schooling (with mitigation protocols), accounting for the age and living arrangements of students and teachers.  The risks of in-person schooling to teachers are comparable to the risks of commuting by automobile.  Valued at a VSL of $10 million, the average daily fatality cost ranges from $0.01 for an unvaccinated young teacher living alone to as much as $29 for an elderly and unvaccinated teacher living with an elderly and unvaccinated spouse.  COVID-19 risk avoidance may also be more amenable to Bayesian updating and selective protection than automobile fatalities are.  The results suggest that economic behaviors can sometimes invert epidemiological patterns when it comes to the spread of infectious diseases in human populations."
Financing Vaccines for Global Health Security,2020-05-25 00:00:00,"Jonathan T. Vu, Benjamin K. Kaplan, Shomesh Chaudhuri, Monique K. Mansoura, Andrew W. Lo",https://www.nber.org/papers/w27212,10.3386/w27212,"Recent outbreaks of infectious pathogens such as Zika, Ebola, and COVID-19 have underscored the need for the dependable availability of vaccines against emerging infectious diseases (EIDs). The cost and risk of R&D programs and uniquely unpredictable demand for EID vaccines have discouraged vaccine developers, and government and nonprofit agencies have been unable to provide timely or sufficient incentives for their development and sustained supply. We analyze the economic returns of a portfolio of EID vaccine assets, and find that under realistic financing assumptions, the expected returns are significantly negative, implying that the private sector is unlikely to address this need without public-sector intervention. We have sized the financing deficit for this portfolio and analyze several potential solutions, including price increases, enhanced public-private partnerships, and subscription models through which individuals would pay annual fees to obtain access to a portfolio of vaccines in the event of an outbreak."
Paid sick-leave and physical mobility: Evidence from the United States during a pandemic,2020-05-11 00:00:00,"Martin Andersen, Johanna Catherine Maclean, Michael F. Pesko, Kosali I. Simon",https://www.nber.org/papers/w27138,10.3386/w27138,"We study the effects of a massive temporary U.S. paid sick leave (PSL) mandate that became effective April 1st, 2020 on self-quarantining, proxied by physical mobility behaviors gleaned from cellular devices.  Such behaviors are critical for containment of infectious diseases.  The national PSL policy was implemented in response to the COVID-19 global pandemic and mandated two weeks of fully compensated paid leave.  We study the impact of this policy using difference-in-differences methods, leveraging pre-policy county-level differences in the share of ‘nonessential’ workers likely eligible for paid sick leave benefits.  We find robust evidence that the policy increased the average number of hours at home and reduced the share of the individuals likely at work.  Comparing the county with the lowest to highest policy exposure, we find that the average hours per day not at home, and at work decreased by 8.9% and 6.9% post-policy."
An SEIR Infectious Disease Model with Testing and Conditional Quarantine,2020-03-30 00:00:00,"David W. Berger, Kyle F. Herkenhoff, Simon Mongey",https://www.nber.org/papers/w26901,10.3386/w26901,"We extend the baseline Susceptible-Exposed-Infectious-Recovered (SEIR) infectious disease epidemiology model to understand the role of testing and case-dependent quarantine. Our model nests the SEIR model. During a period of asymptomatic infection, testing can reveal infection that otherwise would only be revealed later when symptoms develop. Along with those displaying symptoms, such individuals are deemed known positive cases. Quarantine policy is case-dependent in that it can depend on whether a case is unknown, known positive, known negative, or recovered. Testing therefore makes possible the identification and quarantine of infected individuals and release of non-infected individuals. We fix a quarantine technology—a parameter determining the differential rate of transmission in quarantine—and compare simple testing and quarantine policies. We start with a baseline quarantine-only policy that replicates the rate at which individuals are entering quarantine in the US in March, 2020. We show that the total deaths that occur under this policy can occur under looser quarantine measures and a substantial increase in random testing of asymptomatic individuals. Testing at a higher rate in conjunction with targeted quarantine policies can (i) dampen the economic impact of the coronavirus and (ii) reduce peak symptomatic infections—relevant for hospital capacity constraints. Our model can be plugged into richer quantitative extensions of the SEIR model of the kind currently being used to forecast the effects of public health and economic policies."
The Unprecedented Stock Market Impact of COVID-19,2020-04-06 00:00:00,"Scott R. Baker, Nicholas Bloom, Steven J. Davis, Kyle J. Kost, Marco C. Sammon, Tasaneeya Viratyosin",https://www.nber.org/papers/w26945,10.3386/w26945,"No previous infectious disease outbreak, including the Spanish Flu, has impacted the stock market as forcefully as the COVID-19 pandemic. In fact, previous pandemics left only mild traces on the U.S. stock market. We use text-based methods to develop these points with respect to large daily stock market moves back to 1900 and with respect to overall stock market volatility back to 1985. We also evaluate potential explanations for the unprecedented stock market reaction to the COVID-19 pandemic. The evidence we amass suggests that government restrictions on commercial activity and voluntary social distancing, operating with powerful effects in a service-oriented economy, are the main reasons the U.S. stock market reacted so much more forcefully to COVID-19 than to previous pandemics in 1918-19, 1957-58 and 1968."
Incentivized Peer Referrals for Tuberculosis Screening: Evidence from India,2018-11-19 00:00:00,"Jessica Goldberg, Mario Macis, Pradeep Chintagunta",https://www.nber.org/papers/w25279,10.3386/w25279,"We study whether and how peer referrals increase screening, testing, and identification of patients with tuberculosis, an infectious disease responsible for over one million deaths annually. In an experiment with 3,176 patients at 122 tuberculosis treatment centers in India, we find that small financial incentives raise the probability that existing patients refer prospective patients for screening and testing, resulting in cost-effective identification of new cases. Incentivized referrals operate through two mechanisms: peers have private information about individuals in their social networks to target for outreach, and they are more effective than health workers in inducing these individuals to get tested."
Population and Civil War,2017-04-10 00:00:00,"Daron Acemoglu, Leopoldo Fergusson, Simon Johnson",https://www.nber.org/papers/w23322,10.3386/w23322,"Medical and public health innovations in the 1940s quickly resulted in significant health improvements around the world. Countries with initially higher mortality from infectious diseases experienced greater increases in life expectancy, population, and - over the following 40 years - social conflict. This result is robust across alternative measures of conflict and is not driven by differential trends between countries with varying baseline characteristics. At least during this time period, a faster increase in population made social conflict more likely, probably because it increased competition for scarce resources in low income countries."
"Pollution, Infectious Disease, and Mortality: Evidence from the 1918 Spanish Influenza Pandemic",2015-10-12 00:00:00,"Karen Clay, Joshua Lewis, Edson Severnini",https://www.nber.org/papers/w21635,10.3386/w21635,"The 1918 Influenza Pandemic killed millions worldwide and hundreds of thousands in the United States. This paper studies the impact of air pollution on pandemic mortality. The analysis combines a panel dataset on infant and all-age mortality with a novel measure of air pollution based on the burning of coal in a large sample of U.S. cities. We estimate that air pollution contributed significantly to pandemic mortality. Cities that used more coal experienced tens of thousands of excess deaths in 1918 relative to cities that used less coal with similar pre-pandemic socioeconomic conditions and baseline health. Factors related to poverty, public health, and the timing of onset also affected pandemic mortality. The findings support recent medical evidence on the link between air pollution and influenza infection, and suggest that poor air quality was an important cause of mortality during the pandemic."
Death and the Media: Asymmetries in Infectious Disease Reporting During the Health Transition,2015-04-06 00:00:00,"Dora L. Costa, Matthew E. Kahn",https://www.nber.org/papers/w21073,10.3386/w21073,"In the late 19th Century, cities in Western Europe and the United States suffered from high levels of infectious disease. Over a 40 year period, there was a dramatic decline in infectious disease deaths in cities. As such objective progress in urban quality of life took place, how did the media report this trend? At that time newspapers were the major source of information educating urban households about the risks they faced. By constructing a unique panel data base, we find that news reports were positively associated with government announced typhoid mortality counts and the size of this effect actually grew after the local governments made large investments in public goods intended to reduce typhoid rates. News coverage was more responsive to unexpected increases in death rates than to unexpected decreases in death rates. Together, these facts suggest that consumers find bad news is more useful than good news."
"Germs, Social Networks and Growth",2012-10-18 00:00:00,"Alessandra Fogli, Laura Veldkamp",https://www.nber.org/papers/w18470,10.3386/w18470,"Does the pattern of social connections between individuals matter for macroeconomic outcomes? If so, where do these differences come from and how large are their effects? Using network analysis tools, we explore how different social network structures affect technology diffusion and thereby a country's rate of growth. The model also explains how different social networks may emerge endogenously in response to the prevalence of infectious disease. Initial differences in disease prevalence can produce different network structures, leading to divergent levels of income. We compare calibrated model predictions with data. The model and data agree that a one-standard-deviation increase in our index of network diffusion speed results in output growth that is 1/2% higher per year."
Understanding the Twentieth Century Decline in Chronic Conditions Among Older Men,1998-12-01 00:00:00,Dora L. Costa,https://www.nber.org/papers/w6859,10.3386/w6859,"I use a sample of Union Army veterans to trace the impact of a high infant mortality rate in area of enlistment, such infectious disease as acute respiratory infections, measles, typhoid fever, tuberculosis, rheumatic fever, diarrhea, and malaria while in the army, occupation at enlistment, and occupation at older ages on chronic respiratory problems, various heart conditions, and joint and back problems at older ages.  I find that between 1900 and the present the prevalence of respiratory conditions at older ages fell by 70 percent, that of arrhythmias, murmurs, and valvular heart disease by 90 percent, atherosclerosis by 60 percent, and joint and back problems by 30 percent.  Occupational shifts accounted for 15 percent of the decline in joint problems, over 75 percent of the decline in back problems, and 25 percent of the decline in respiratory difficulties.  Reduced exposure to infectious disease accounted for at least 10 to 25 percent of the decline in chronic conditions.  I also find that the duration of chronic conditions has remained unchanged since the early 1900s but that if disability is measured by difficulty in walking, men with chronic conditions are now less disabled than they were in the past."
Economic Epidemiology and Infectious Diseases,1999-03-01 00:00:00,Tomas Philipson,https://www.nber.org/papers/w7037,10.3386/w7037,"Infectious disease is currently the main cause of mortality in the world and has been even more important historically.  This paper reviews recent research in economic epidemiology. Specifically, it discusses the occurrence of infectious diseases and the effects of public health interventions designed to control them. Several key points include: differences in the predictions regarding short- and long-run disease occurrence between rational and epidemiological epidemics, the nonstandard effects of interventions when epidemics are rational, the desirability and possibility of eradicating infectious diseases, as well as the components of the welfare loss induced by infectious diseases."
"Long-Term Declines in Disability Among Older Men: Medical Care, Public Health, and Occupational Change",2000-03-01 00:00:00,Dora L. Costa,https://www.nber.org/papers/w7605,10.3386/w7605,"Functional disability (difficulty in walking , difficulty in bending, paralysis, blindness in at least one eye, and deafness in at least one ear) in the United States has fallen at an average annual rate of 0.6 percent among men age 50 to 74 from the early twentieth century to the early 1990s.  Twenty-four to 41 percent of this decline is attributable to innovations in medical care, 37 percent to reduced chronic disease rates, and the remainder is unexplained.  The portion due to reduced chronic disease rates can be subdivided into the 9 percent accounted for by reduced infectious disease rates (particularly rheumatic fever, malaria, typhoid, and acute respiratory infections), the 7 percent accounted for by occupational shifts away from manual labor and to white collar jobs, and the 21 percent that is unexplained."
Understanding Mid-Life and Older Age Mortality Declines: Evidence from Union Army Veterans,2000-11-01 00:00:00,Dora L. Costa,https://www.nber.org/papers/w8000,10.3386/w8000,"During the twentieth century the 17 year survival rate of 50-64 year old men rose by 24 percentage points. I examine waiting time until death from all natural causes and from all chronic, all acute, respiratory, stomach, infectious, all heart, ischemic, and myocarditis disease among Union Army veterans first observed in 1900. The effect of such specific early life infections as stomach ailments, rheumatic fever, syphilis, measles, respiratory infections, malaria, diarrhea, and tuberculosis on older age mortality depended upon the cause of death that was being investigated but all of these infections reduced cause-specific longevity. Men who grew up in a large city faced an elevated mortality risk from all causes of death controlling for later residence. The immediate effect of reduced infectious disease rates and reduced mortality from acute disease accounts for 62 percent of the twentieth century increase in survival rates and the long-run effect of reduced early life infectious disease rates accounts for 12 percent of the increase. The findings imply that although the current effects of improved public health and medical care are larger than the cohort effects, cost-benefit analyses and forecasts of future mortality still need to account for long-run effects; that mortality in populations in which infectious, respiratory, and parasitic deaths are common is best described by a competing risks model; and, that the urbanization that accompanied early industrialization was extremely costly."
You Only Die Once: Managing Discrete Interdependent Risks,2003-08-04 00:00:00,"Geoffrey Heal, Howard Kunreuther",https://www.nber.org/papers/w9885,10.3386/w9885,"This paper extends our earlier analysis of interdependent security issues to a general class of problems involving discrete interdependent risks with heterogeneous agents. There is a threat of an event that can only happen once, and the risk depends on actions taken by others. Any agent's incentive to invest in managing the risk depends on the actions of others. Security problems at airlines and in computer networks come into this category, as do problems of risk management in organizations facing the possibility of bankruptcy, and individuals' choices about whether to be vaccinated against an infectious disease. Surprisingly the framework also covers certain aspects of investment in R&D. Here we characterize Nash equilibria with heterogeneous agents and give conditions for tipping and cascading of equilibria."
Becoming Oldest-Old: Evidence from Historical U.S. Data,2003-09-01 00:00:00,"Dora L. Costa, Joanna Lahey",https://www.nber.org/papers/w9933,10.3386/w9933,"We argue that the environment determines life span, using historical data to show that such indicators of environmental insults in early childhood and young adulthood as quarter of birth, residence, occupation, wealth, and the incidence of specific infectious diseases affected older age mortality. Consistent with improvements in early life factors, we find that the effect of quarter of birth on older age mortality has diminished over the twentieth century and that the declining impact of quarter of birth explains 16 to 17 percent of the difference in ten year mortality rates of Americans age 60-79 in 1900 and in 1960-1980. We estimate that at least one-fifth of the increase between 1900 and 1999 in the probability of a 65 year old surviving to age 85 may be attributable to early life conditions. We also present suggestive evidence on the mortality trajectory of the oldest old in the first half of the twentieth century that implies that the shape of the mortality trajectory, though not its level, has remained constant."
Health and Wealth Accumulation: Evidence from Nineteenth-Century America,2003-10-20 00:00:00,Chulhee Lee,https://www.nber.org/papers/w10035,10.3386/w10035,"This study explores how the health of Union Army recruits while in the service affected their wealth accumulation through 1870. Wartime wounds and exposure to combat, measured by the company mortality from wounds, had strong negative effects on subsequent savings. Variables on illnesses while in service, if corrected for the potential bias arising from omitted variables by using instrumental variables, also greatly diminished wealth accumulations. The economic impact of poor health was particularly strong for unskilled workers. These results suggest that health was a powerful determinant of economic mobility in the nineteenth century. The strong influences on wealth accumulations of various infectious diseases, such as malaria, typhoid, and diarrhea, found in this study point out that the economic gains from the improvement of the disease environment should be enormous. This study also suggests that the direct economic costs of the Civil War were probably much greater than previously thought, if the persistent adverse effects of wartime experiences on veterans' health are considered."
Interdependent Security: A General Model,2004-08-30 00:00:00,"Geoffrey Heal, Howard Kunreuther",https://www.nber.org/papers/w10706,10.3386/w10706,"In an interdependent world the risks faced by any one agent depend not only on its choices but also on those of all others. Expectations about others' choices will influence investments in risk-management, and the outcome can be sub-optimal investment all round. We model this as the Nash equilibrium of a game and give conditions for such a sub-optimal equilibrium to be tipped to an optimal one. We also characterize the smallest coalition to tip an equilibrium, the minimum critical coalition, and show that this is also the cheapest critical coalition, so that there is no less expensive way to move the system from the sub- optimal to the optimal equilibrium. We illustrate these results by reference to airline security, the control of infectious diseases via vaccination and investment in research and development."
Race and Older Age Mortality: Evidence from Union Army Veterans,2004-11-08 00:00:00,Dora L. Costa,https://www.nber.org/papers/w10902,10.3386/w10902,"This paper uses the records of the Union Army to compare the older age mortality experience of the first black and white cohorts who reached middle and late ages in the twentieth century. Blacks faced a greater risk of death from all causes, especially in large cities, from infectious and parasitic diseases, from genito-urinary disease, and from heart disease, particularly valvular heart disease. Blacks' greater risk of death was the result both of the worse conditions in which they lived at the time of their deaths and of their lifelong poorer nutritional status and higher incidence of infectious disease. Compared to the 1821-40 black cohort, the 1841-50 black cohort was both under greater stress at a young age and had higher older age mortality rates."
"Death and the City: Chicago's Mortality Transition, 1850-1925",2005-06-20 00:00:00,"Joseph P. Ferrie, Werner Troesken",https://www.nber.org/papers/w11427,10.3386/w11427,"Between 1850 and 1925, the crude death rate in Chicago fell by 60 percent, driven by reductions in infectious disease rates and infant and child mortality. What lessons might be drawn from the mortality transition in Chicago, and American cities more generally? What were the policies that had the greatest effect on infectious diseases and childhood mortality? Were there local policies that slowed the mortality transition? If the transition to low mortality in American cities was driven by forces largely outside the control of local governments (higher per capita incomes or increases in the amount and quality of calories available to urban dwellers from rising agricultural productivity), then expensive public health projects, such as the construction of public water and sewer systems, probably should have taken a back seat to broader national policies to promote overall economic growth. The introduction of pure water explains between 30 and 50 percent of Chicago's mortality decline, and that other interventions, such as the introduction of the diphtheria antitoxin and milk inspection had much smaller effects. These findings have important implications for current policy debates and economic development strategies."
